{
  "authority_ref": "refs/heads/main",
  "generation_id": "8ba65297272b2c684603d592909e1b97d1c0df0af1afc08f62aa50a34381dc11",
  "generation_sha256": "sha256:1dd8ae81dc3bc4c75e2137bb64fdcddc26216234ee88421ef4addb6375d5cb1a",
  "main_commit": "9429c69c2d7e27eeb97e1bcb992e841c8ba3a4e7",
  "schema_version": "newrouge.knowledge-index-pointer.v1",
  "source_snapshot_id": "aa247edcc9143162174f0c9cb407294239ee44efbd2570368995d89085f262cf"
}
