{
  "authority_ref": "refs/heads/main",
  "generation_id": "3c4e86506c32ba3c81e336a2f12a529acb8e39ef2d7f6dd0bb7f84363070066e",
  "generation_sha256": "sha256:f9cd1d761d5a1638fb598f384fb358f2898649bb6ad60146b403a527cfe336bc",
  "main_commit": "bbdb1f2c5ff911ce54a90bc80e142a2dfd0ecd01",
  "schema_version": "newrouge.knowledge-index-pointer.v1",
  "source_snapshot_id": "154d4c85797add442e80ffdc118a769fab538a551547daedc80a6d375b396a7b"
}
